{
  "$schema": "https://json-schema.org/draft/2020-12/schema",
  "$id": "https://coi-lang.dev/schemas/package.schema.json",
  "title": "Coi Package Entry",
  "description": "Individual package file with metadata and release history",
  "type": "object",
  "additionalProperties": false,
  "required": ["name", "schema-version", "repository", "releases", "createdAt"],
  "properties": {
    "$schema": {
      "type": "string"
    },
    "name": {
      "type": "string",
      "pattern": "^[a-z0-9][a-z0-9._-]{1,62}$",
      "description": "Package name (lowercase, letters/numbers/._-)"
    },
    "schema-version": {
      "type": "integer",
      "minimum": 1,
      "description": "Schema version for the package entry format"
    },
    "repository": {
      "type": "string",
      "format": "uri",
      "pattern": "^https://github\\.com/[^/]+/[^/]+/?$"
    },
    "description": {
      "type": "string",
      "maxLength": 300
    },
    "homepage": {
      "type": "string",
      "format": "uri"
    },
    "keywords": {
      "type": "array",
      "items": {
        "type": "string",
        "minLength": 1,
        "maxLength": 32
      },
      "maxItems": 20,
      "uniqueItems": true
    },
    "releases": {
      "type": "array",
      "minItems": 1,
      "items": {
        "$ref": "#/$defs/release"
      },
      "description": "Release history, newest first"
    },
    "createdAt": {
      "type": "string",
      "pattern": "^\\d{4}-\\d{2}-\\d{2}$"
    }
  },
  "$defs": {
    "release": {
      "type": "object",
      "additionalProperties": false,
      "required": ["version", "compiler-drop", "releasedAt", "source"],
      "properties": {
        "version": {
          "type": "string",
          "pattern": "^[0-9]+\\.[0-9]+\\.[0-9]+(-[a-zA-Z0-9.]+)?$",
          "description": "Semver version (e.g. 1.0.0, 0.2.1-beta)"
        },
        "compiler-drop": {
          "type": "object",
          "additionalProperties": false,
          "required": ["min", "tested-on"],
          "properties": {
            "min": {
              "type": "integer",
              "minimum": 1,
              "description": "Optimistic minimum compiler drop; assumed compatible until proven otherwise"
            },
            "tested-on": {
              "type": "integer",
              "minimum": 1,
              "description": "Latest compiler drop this release has been tested on"
            }
          }
        },
        "source": {
          "type": "object",
          "additionalProperties": false,
          "required": ["commit", "sha256"],
          "properties": {
            "commit": {
              "type": "string",
              "pattern": "^[a-fA-F0-9]{40}$",
              "description": "Git commit SHA for this release"
            },
            "sha256": {
              "type": "string",
              "pattern": "^[a-fA-F0-9]{64}$",
              "description": "SHA256 of the release tarball"
            }
          }
        },
        "releasedAt": {
          "type": "string",
          "pattern": "^\\d{4}-\\d{2}-\\d{2}$"
        }
      }
    }
  }
}
