{
  "$schema": "../schema/package.schema.json",
  "name": "supabase",
  "schema-version": 1,
  "repository": "https://github.com/coi-lang/pkg-supabase",
  "description": "Supabase client package for Coi.",
  "keywords": ["supabase", "auth", "database", "storage"],
  "releases": [
    {
      "version": "0.1.0",
      "compiler-drop": {
        "min": 350,
        "tested-on": 350
      },
      "source": {
        "commit": "9accf4a2af32134fbadbe7d924577e018697d298",
        "sha256": "8fde3f16957b376c7ca6d92126cea682d00c38fdd69f3189711dd163ff714c69"
      },
      "releasedAt": "2026-02-16"
    }
  ],
  "createdAt": "2026-02-16"
}
